{
  "study": "study1",
  "weight": "dynamic",
  "dflash": true,
  "vision": false,
  "np": 1,
  "metrics": {
    "agg_tok_s": 21.82244842767562,
    "total_tokens": 1536,
    "wall_s": 70.38623576500322,
    "ttft_p50": 0.5070528779997403,
    "ttft_p90": 0.5168641470008879,
    "tpot_median": 0.048643696935294994,
    "agg_tok_s_min": 21.66475346023376,
    "agg_tok_s_max": 22.25355510450038,
    "reps": 3,
    "finish_reason_dist": {
      "length": 18
    }
  },
  "mem": {
    "VmPeak_kib": 30697832,
    "VmPeak_gib": 29.28,
    "VmHWM_kib": 2041172,
    "VmHWM_gib": 1.95,
    "VmRSS_kib": 2041172,
    "VmRSS_gib": 1.95,
    "RssShmem_kib": 65536,
    "RssShmem_gib": 0.06,
    "vram_used_mib": 1084.4,
    "vram_total_mib": 32768.0
  },
  "acceptance": {
    "accepted_draft_tokens": 3955,
    "draft_tokens": 16656,
    "acceptance_rate": 0.2374519692603266,
    "avg_accepted_per_step": 4.887
  },
  "acceptance_source": "log",
  "power_temp": {
    "power_w": null,
    "temp_c": 59.0
  },
  "llama_log_mem": "",
  "manifest": {
    "flags": "-m models/muse-glimmer-30B-kquant-dynamic.gguf -ngl 999 -np 1 -c 8192 --jinja --temp 0 --seed 0 --metrics --port 8080 --host 127.0.0.1 -md models/dflash-kquant.gguf -ngld 99 --spec-type draft-dflash --spec-draft-n-max 16",
    "seed": 0,
    "reps": 3,
    "build": "0b1bad1",
    "rocm": "{\"card0\": {\"Card Series\": \"AMD Radeon Graphics\", \"Card Model\": \"0x1586\", \"Card Vendor\": \"Advanced Micro Devices, Inc. [AMD/ATI]\", \"Card SKU\": \"STRXLGEN\", \"Subsystem ID\": \"-0x72ff\", \"Device Rev\": \"0xd1\", \"Node ID\": \"1\", \"GUID\": \"21984\", \"GFX Version\": \"gfx1151\"}}",
    "kernel": "6.17.0-1032-oem",
    "date": "2026-08-12"
  },
  "acceptance_metrics_secondary": {
    "accepted_draft_tokens": 3955.0,
    "draft_tokens": 16656.0,
    "avg_accepted_per_step": 3.4632224168126093,
    "acceptance_rate": 0.2374519692603266
  }
}